{
  "version": "0.1.0",
  "pilotId": "exact-anchor-review-pilot-2026-q1",
  "status": "internal_draft",
  "reviewMode": "internal_public_source_review",
  "scope": {
    "frameworks": [
      "ISO 27001",
      "SOC 2",
      "IRAP",
      "GDPR",
      "Cyber Essentials",
      "NCSC CAF 4.0",
      "NIST CSF 2.0",
      "NIST SP 800-53 Rev. 5.1",
      "EU AI Act",
      "EU GPAI Code of Practice",
      "NIST AI RMF 1.0",
      "ISO/IEC 42001",
      "ISO/IEC 23894",
      "ISO/IEC 42005"
    ],
    "controlsCovered": 21,
    "note": "Public exact anchors are only published where official text or official machine-readable source material is public. Planned controls with no public fixture yet are allowed into the pilot so framework expansion can stay honest without pretending implementation already exists. Proprietary standards remain explicitly blocked until licensed framework review is complete."
  },
  "summary": {
    "reviewEntries": 101,
    "publicSourceReviewed": 59,
    "candidatePublicSourceUnreviewed": 14,
    "blockedNonpublicSourceReview": 28
  },
  "controls": [
    {
      "controlId": "oc.id-01",
      "title": "Scoped administrative MFA enforcement",
      "decompositionNote": "The corridor proves narrow administrative MFA enforcement, not full identity governance or all access-review obligations.",
      "reviews": [
        {
          "framework": "IRAP",
          "anchorType": "ism_control",
          "anchorId": "ISM-1173",
          "relation": "subset-of",
          "mappingMethod": "functional",
          "reviewStatus": "public_source_reviewed",
          "confidence": "medium",
          "sourceAvailability": "public_text",
          "externalReviewState": "not_yet_external_reviewed",
          "rationale": "The corridor proves that scoped administrative identities require MFA in the declared environment. That is a narrow technical subset of the broader privileged-user MFA requirement.",
          "authoritativeSource": {
            "authority": "ACSC ISM",
            "documentId": "Essential Eight maturity model",
            "locator": "ISM-1173"
          }
        },
        {
          "framework": "GDPR",
          "anchorType": "article_paragraph_subpoint",
          "anchorId": "Article 32(1)(b)",
          "relation": "subset-of",
          "mappingMethod": "functional",
          "reviewStatus": "public_source_reviewed",
          "confidence": "medium",
          "sourceAvailability": "public_text",
          "externalReviewState": "not_yet_external_reviewed",
          "rationale": "Scoped administrative MFA contributes to the ongoing confidentiality, integrity, availability, and resilience of processing systems and services, but it is only one narrow technical slice of Article 32.",
          "authoritativeSource": {
            "authority": "EUR-Lex",
            "documentId": "CELEX:02016R0679-20160504",
            "locator": "Article 32(1)(b)"
          }
        },
        {
          "framework": "Cyber Essentials",
          "anchorType": "control_theme",
          "anchorId": "User Access Control / Multi-factor authentication (MFA)",
          "relation": "subset-of",
          "mappingMethod": "functional",
          "reviewStatus": "public_source_reviewed",
          "confidence": "medium",
          "sourceAvailability": "public_text",
          "externalReviewState": "not_yet_external_reviewed",
          "rationale": "Scoped administrative MFA enforcement is a narrow machine-checkable slice of the Cyber Essentials user access control theme, specifically the current MFA requirement for internet-exposed services and admin access.",
          "authoritativeSource": {
            "authority": "NCSC",
            "documentId": "Cyber Essentials Requirements for IT Infrastructure v3.2",
            "locator": "User Access Control / Multi-factor authentication (MFA)"
          }
        },
        {
          "framework": "NCSC CAF 4.0",
          "anchorType": "principle",
          "anchorId": "Principle B2",
          "relation": "subset-of",
          "mappingMethod": "functional",
          "reviewStatus": "public_source_reviewed",
          "confidence": "medium",
          "sourceAvailability": "public_text",
          "externalReviewState": "not_yet_external_reviewed",
          "rationale": "The corridor proves one narrow access-control invariant that supports CAF Principle B2 on identity and access control without claiming the whole principle is satisfied.",
          "authoritativeSource": {
            "authority": "NCSC",
            "documentId": "Cyber Assessment Framework v4.0 supplementary information",
            "locator": "Principle B2 Identity and Access Control"
          }
        },
        {
          "framework": "NIST CSF 2.0",
          "anchorType": "function_category_subcategory",
          "anchorId": "PR.AA-01",
          "relation": "subset-of",
          "mappingMethod": "functional",
          "reviewStatus": "public_source_reviewed",
          "confidence": "medium",
          "sourceAvailability": "public_text",
          "externalReviewState": "not_yet_external_reviewed",
          "rationale": "Scoped administrative MFA enforcement is a narrow implementation slice of the identities-and-credentials management outcome under CSF 2.0.",
          "authoritativeSource": {
            "authority": "NIST",
            "documentId": "Cybersecurity Framework 2.0 Core",
            "locator": "PR.AA-01"
          }
        },
        {
          "framework": "NIST SP 800-53 Rev. 5.1",
          "anchorType": "control",
          "anchorId": "IA-2",
          "relation": "subset-of",
          "mappingMethod": "functional",
          "reviewStatus": "public_source_reviewed",
          "confidence": "medium",
          "sourceAvailability": "public_text",
          "externalReviewState": "not_yet_external_reviewed",
          "rationale": "The corridor proves a narrow organizational-user MFA condition that is safely modeled as a subset of the broader identification and authentication control.",
          "authoritativeSource": {
            "authority": "NIST",
            "documentId": "SP 800-53 Rev. 5.1",
            "locator": "IA-2"
          }
        },
        {
          "framework": "ISO 27001",
          "anchorType": "licensed_framework_anchor",
          "relation": "undetermined",
          "mappingMethod": "semantic",
          "reviewStatus": "blocked_nonpublic_source_review",
          "confidence": "withheld",
          "sourceAvailability": "licensed_text_required",
          "externalReviewState": "not_started",
          "candidateAnchorKinds": [
            "clause",
            "annex_a_control"
          ],
          "blocker": "Exact ISO 27001 anchor publication requires licensed source review. Public ISO material is sufficient to establish the clause-versus-Annex-A structure, but not a defensible open exact-anchor corpus.",
          "rationale": "The current public boundary is intentionally honest about ISO exact-anchor incompleteness.",
          "authoritativeSource": {
            "authority": "ISO/SC27",
            "documentId": "ISO/IEC 27001",
            "locator": "Clauses 4-10 and Annex A structural boundary"
          }
        },
        {
          "framework": "SOC 2",
          "anchorType": "licensed_framework_anchor",
          "relation": "undetermined",
          "mappingMethod": "semantic",
          "reviewStatus": "blocked_nonpublic_source_review",
          "confidence": "withheld",
          "sourceAvailability": "licensed_text_required",
          "externalReviewState": "not_started",
          "candidateAnchorKinds": [
            "criterion",
            "point_of_focus"
          ],
          "blocker": "Exact SOC 2 anchor publication requires licensed or account-gated Trust Services Criteria review. Public AICPA material establishes the TSC category structure, but not a publishable exact-anchor corpus for this project.",
          "rationale": "The pilot encodes the blocker explicitly so the public mapping is not overstated.",
          "authoritativeSource": {
            "authority": "AICPA",
            "documentId": "2017 Trust Services Criteria (With Revised Points of Focus - 2022)",
            "locator": "Trust Services Criteria category structure only"
          }
        }
      ]
    },
    {
      "controlId": "oc.id-04",
      "title": "Unique infrastructure access identities required",
      "decompositionNote": "The corridor proves that the scoped infrastructure access plane requires named identities and that no shared administrative accounts are present in the declared environment. It does not prove full authentication strength, all break-glass governance, or the correctness of every privilege decision.",
      "reviews": [
        {
          "framework": "IRAP",
          "anchorType": "ism_control",
          "anchorId": "ISM-1263",
          "relation": "subset-of",
          "mappingMethod": "functional",
          "reviewStatus": "public_source_reviewed",
          "confidence": "medium",
          "sourceAvailability": "public_text",
          "externalReviewState": "not_yet_external_reviewed",
          "rationale": "The corridor proves a narrow privileged-identity invariant for the scoped infrastructure access plane: named identities are required and shared administrative accounts are absent. That is a defensible functional subset of the ISM requirement that unique privileged user accounts be used for administering individual server applications.",
          "authoritativeSource": {
            "authority": "ACSC ISM",
            "documentId": "Guidelines for personnel security",
            "locator": "ISM-1263"
          }
        },
        {
          "framework": "GDPR",
          "anchorType": "article_paragraph_subpoint",
          "anchorId": "Article 32(1)(b)",
          "relation": "subset-of",
          "mappingMethod": "functional",